{
  "$schema": "../web-provider-evidence.schema.json",
  "schemaVersion": 1,
  "evidenceKind": "web-source",
  "platform": "web",
  "provider": "regex-source",
  "surfaceId": "example-web-surface",
  "webPolicyVersion": "1.0.0",
  "captureId": "regex-source-light",
  "routeId": "example-home",
  "owner": "example-web-owner",
  "viewport": { "id": "desktop", "width": 1280, "height": 800 },
  "theme": "light",
  "fontScale": 1,
  "reduceMotion": false,
  "execution": { "status": "completed", "capability": "full", "reason": "" },
  "findings": [
    {
      "id": "generated-side-tab",
      "upstreamRuleId": "side-tab",
      "owner": "example-web-owner",
      "path": "generated/example.css",
      "message": "generated side accent border detected",
      "artifact": {
        "path": "generated/example.css",
        "fingerprintSha256": "1111111111111111111111111111111111111111111111111111111111111111",
        "generated": true
      }
    }
  ]
}
