{
  "$schema": "../web-provider-evidence.schema.json",
  "schemaVersion": 1,
  "evidenceKind": "web-source",
  "platform": "web",
  "provider": "static-html",
  "surfaceId": "example-web-surface",
  "webPolicyVersion": "1.0.0",
  "captureId": "static-html-light",
  "routeId": "example-home",
  "owner": "example-web-owner",
  "viewport": { "id": "desktop", "width": 1280, "height": 800 },
  "theme": "light",
  "fontScale": 1,
  "reduceMotion": false,
  "execution": {
    "status": "not-run",
    "capability": "regex-fallback",
    "reason": "parser-dependency-missing"
  },
  "findings": []
}
